{
  "bounty_schema_version": "0.4",
  "active": true,
  "program": {
    "name": "Example Candle Co. Gifts",
    "url": "https://candles.example.com/gifts"
  },
  "earn": {
    "display": "Selected candles ship with a free wick trimmer while stock lasts — the product page says which.",
    "type": "other"
  },
  "scope": "selected",
  "listed_by": "store",
  "terms_url": "https://candles.example.com/gifts/terms",
  "updated_at": "2026-10-14"
}
